{
 "schema_version": 1,
 "gate_id": "EV-08",
 "status": "pass",
 "version_matrix": {
  "linguist-anki-bridge": "0.1.0",
  "git_commit": "6264fce0cc30c94d60a1b1ab94cd04e813923d38",
  "rustc": "rustc 1.99.0 (b940084d7 2026-09-28) (Arch Linux rust 1:1.99.0-1)",
  "cargo": "cargo 1.99.0 (5f94df478 2026-08-27) (Arch Linux rust 1:1.99.0-1)",
  "rust_msrv_declared": "1.98.1",
  "python": "Python 3.14.8",
  "anki_python": "Python 3.14.7",
  "anki": "25.09.2 3d813c83",
  "node": "v26.11.1",
  "tesseract": "tesseract 5.5.3",
  "tesseract_languages": "eng,jpn,osd,vie",
  "ollama": "0.40.1",
  "kernel": "Linux 7.2.8-5-omarchy-bore",
  "crate:ammonia": "4.2.0",
  "crate:clap": "4.6.7",
  "crate:image": "0.25.10",
  "crate:libsqlite3-sys": "0.38.2",
  "crate:reqwest": "0.13.5",
  "crate:rusqlite": "0.40.2",
  "crate:rustls": "0.23.45",
  "crate:schemars": "1.2.2",
  "crate:serde": "1.0.229",
  "crate:serde_jcs": "0.2.0",
  "crate:serde_json": "1.0.151",
  "crate:symphonia": "0.6.1",
  "crate:toml": "0.9.12+spec-1.1.0",
  "crate:uuid": "1.26.1",
  "crate:yaml-rust2": "0.13.0",
  "crate:zip": "8.6.0",
  "crate:zstd": "0.14.0"
 },
 "fixture_hashes": {
  "crates/linguist-application/tests/fixtures/semantic/corpus-v1.json": "c379e00ecb062cec2a83682ee1502c2a00699b5bd32bf797aa3b945e920c6e58"
 },
 "commands": [
  {
   "redacted_argv": [
    "cargo",
    "test",
    "--locked",
    "-p",
    "linguist-application",
    "--test",
    "semantic_corpus",
    "--",
    "--nocapture"
   ],
   "invocation_digest": "ee29b8629d31b57d6dfbdfd723a3867c746ea1693b5e3cf253b6ad2ddfd41167",
   "exit_code": 0,
   "output_digest": "373124311ab19f4a5f07f87640cc1c4c04bcc28077977ecde8bcd60017166cbe"
  },
  {
   "redacted_argv": [
    "/usr/bin/python3.14",
    "scripts/verify-native-inspection.py"
   ],
   "invocation_digest": "5437181b99c5c2dcfc85645756472e561c325cc2611b8618d5c4e927247c6e1f",
   "exit_code": 0,
   "output_digest": "b500462c80ec942e0b1568164bd05bff29c7828ebe476b4c6c7a53a833023c8c"
  },
  {
   "redacted_argv": [
    "cargo",
    "test",
    "--locked",
    "-p",
    "linguist-cli",
    "--test",
    "desktop_scenarios",
    "--",
    "--ignored",
    "--test-threads",
    "1",
    "--nocapture"
   ],
   "invocation_digest": "20e337ed703325bbbeaa96024788d83947d339a8c7c750ec1d6b4d1c5b2de29c",
   "exit_code": 0,
   "output_digest": "5d4080e1a8f81ac137a9a36a2241f9c6c8812a91fb6f33579b5da85fd68ab633"
  }
 ],
 "assertions": [
  {
   "name": "120 fixtures preserve every source field and media byte",
   "passed": true,
   "observed": "{\"grammar_add\": (30, 30), \"grammar_revamp\": (30, 30), \"vocab_add\": (30, 30), \"vocab_revamp\": (30, 30)}"
  },
  {
   "name": "native inspection reads note/card/review/media",
   "passed": true,
   "observed": "bounded helper"
  },
  {
   "name": "scenario captures archive the exact Anki fields",
   "passed": true,
   "observed": "CLI capture vs live note"
  }
 ],
 "artifact_refs": [
  "docs/cli/evidence/release-2026-10-10/logs/native_inspection.txt",
  "docs/cli/evidence/release-2026-10-10/logs/scenarios.txt",
  "docs/cli/evidence/release-2026-10-10/logs/semantic_corpus.txt",
  "docs/cli/evidence/release-2026-10-10/scenarios/batch_vocab_revamp.txt",
  "docs/cli/evidence/release-2026-10-10/scenarios/grammar_add.txt",
  "docs/cli/evidence/release-2026-10-10/scenarios/grammar_split.txt",
  "docs/cli/evidence/release-2026-10-10/scenarios/grammar_split_crash.txt",
  "docs/cli/evidence/release-2026-10-10/scenarios/identity_preconditions.txt",
  "docs/cli/evidence/release-2026-10-10/scenarios/native_faults.txt",
  "docs/cli/evidence/release-2026-10-10/scenarios/vocab_add.txt",
  "docs/cli/evidence/release-2026-10-10/scenarios/vocab_revamp.txt",
  "docs/cli/evidence/release-2026-10-10/scenarios/vocab_revamp_home_deck.txt",
  "docs/cli/evidence/release-2026-10-10/scenarios/vocab_split.txt"
 ],
 "failure_code": null
}
