{
 "schema_version": 1,
 "gate_id": "EV-14",
 "status": "pass",
 "version_matrix": {
  "linguist-anki-bridge": "0.1.0",
  "git_commit": "0beac81a472f24c81a7e52abfc9d0a6daeaf964d",
  "rustc": "rustc 1.99.0 (b940084d7 2026-09-28) (Arch Linux rust 1:1.99.0-1)",
  "cargo": "cargo 1.99.0 (5f94df478 2026-08-27) (Arch Linux rust 1:1.99.0-1)",
  "rust_msrv_declared": "1.98.1",
  "python": "Python 3.14.8",
  "anki_python": "Python 3.14.7",
  "anki": "25.09.2 3d813c83",
  "node": "v26.11.1",
  "tesseract": "tesseract 5.5.3",
  "tesseract_languages": "eng,jpn,osd,vie",
  "ollama": "0.40.1",
  "kernel": "Linux 7.2.8-5-omarchy-bore",
  "crate:ammonia": "4.2.0",
  "crate:clap": "4.6.7",
  "crate:image": "0.25.10",
  "crate:libsqlite3-sys": "0.38.2",
  "crate:reqwest": "0.13.5",
  "crate:rusqlite": "0.40.2",
  "crate:rustls": "0.23.45",
  "crate:schemars": "1.2.2",
  "crate:serde": "1.0.229",
  "crate:serde_jcs": "0.2.0",
  "crate:serde_json": "1.0.151",
  "crate:symphonia": "0.6.1",
  "crate:toml": "0.9.12+spec-1.1.0",
  "crate:uuid": "1.26.1",
  "crate:yaml-rust2": "0.13.0",
  "crate:zip": "8.6.0",
  "crate:zstd": "0.14.0"
 },
 "fixture_hashes": {
  "crates/linguist-cli/tests/desktop_scenarios.rs": "37a06ebfd75f710fd53789aec6105b752b60a9a63be7b1acba9db7b73ccb2822",
  "scripts/disposable-anki-desktop.py": "622dc4e88a32ed55c04b0633b4a85ced0e32c0b9d1d78b9adfd6f43221a4e132"
 },
 "commands": [
  {
   "redacted_argv": [
    "cargo",
    "build",
    "--locked",
    "-p",
    "linguist-cli"
   ],
   "invocation_digest": "a0fa114f6102ca799a3397e7dd51a2a8b69db738aedb28338d4434313632678d",
   "exit_code": 0,
   "output_digest": "10d3d40e5691848eb1f2ad3dfe58c963772c50931d377b7a2836b3e34f974a4a"
  },
  {
   "redacted_argv": [
    "cargo",
    "tree",
    "--locked",
    "-p",
    "linguist-cli",
    "-e",
    "normal,build",
    "--prefix",
    "none",
    "--format",
    "{p}"
   ],
   "invocation_digest": "63f46152fef7ce228d8689ee24de8591e04e5316b6de5674d61dd29368670dc7",
   "exit_code": 0,
   "output_digest": "7fc3169022e8c84d20fb3cbfca169b5e229d53daf1c1f81b55ef9965cdf55e69"
  },
  {
   "redacted_argv": [
    "cargo",
    "test",
    "--locked",
    "-p",
    "linguist-cli",
    "--test",
    "release_ux",
    "--test",
    "release_coverage"
   ],
   "invocation_digest": "43667525d575e37c30a3d497e167b00eb2ddf902aaafc836ff785fb4c5f67481",
   "exit_code": 0,
   "output_digest": "0d2bac06a57071301c24c3f54ee727f0aff2f6e0a3ffc7b7a052848d2c35110c"
  },
  {
   "redacted_argv": [
    "cargo",
    "test",
    "--locked",
    "-p",
    "linguist-cli",
    "--test",
    "desktop_scenarios",
    "--",
    "--ignored",
    "--test-threads",
    "1",
    "--nocapture"
   ],
   "invocation_digest": "20e337ed703325bbbeaa96024788d83947d339a8c7c750ec1d6b4d1c5b2de29c",
   "exit_code": 0,
   "output_digest": "622f250c1f56b596553cfdba7157887be6b120a3051de097f68746375821389b"
  },
  {
   "redacted_argv": [
    "python3",
    "scripts/op-coverage.py",
    "--check"
   ],
   "invocation_digest": "bfafddb55b9cef0b4e49519011f5292c039e53129923e1368e022516f7157f05",
   "exit_code": 0,
   "output_digest": "d8760763be63067f00789fcf42648cb7e89259b37690e733415676ec0b8b6596"
  }
 ],
 "assertions": [
  {
   "name": "headless build without Qt",
   "passed": true,
   "observed": "0 Qt crates"
  },
  {
   "name": "fresh-home, pipes, Unicode, SSH, interrupts, limits",
   "passed": true,
   "observed": "release_ux + release_coverage"
  },
  {
   "name": "all 61 operations have command-level tests",
   "passed": true,
   "observed": "docs/cli/implementation/op-coverage.md"
  },
  {
   "name": "four workflows prepare->review->apply->restore in disposable Anki",
   "passed": true,
   "observed": "batch_vocab_revamp, grammar_add, grammar_split, grammar_split_crash, identity_preconditions, native_faults, vocab_add, vocab_revamp, vocab_revamp_home_deck, vocab_split"
  },
  {
   "name": "every step is a CLI command (plans bind, resolve-history, apply/restore/rollback --apply)",
   "passed": true,
   "observed": "desktop_scenarios; the test only creates source notes, studies and observes"
  }
 ],
 "artifact_refs": [
  "docs/cli/evidence/release-2026-10-10/logs/build.txt",
  "docs/cli/evidence/release-2026-10-10/logs/op_coverage.txt",
  "docs/cli/evidence/release-2026-10-10/logs/qt_tree.txt",
  "docs/cli/evidence/release-2026-10-10/logs/scenarios.txt",
  "docs/cli/evidence/release-2026-10-10/logs/ux.txt",
  "docs/cli/evidence/release-2026-10-10/scenarios/batch_vocab_revamp.txt",
  "docs/cli/evidence/release-2026-10-10/scenarios/grammar_add.txt",
  "docs/cli/evidence/release-2026-10-10/scenarios/grammar_split.txt",
  "docs/cli/evidence/release-2026-10-10/scenarios/grammar_split_crash.txt",
  "docs/cli/evidence/release-2026-10-10/scenarios/identity_preconditions.txt",
  "docs/cli/evidence/release-2026-10-10/scenarios/native_faults.txt",
  "docs/cli/evidence/release-2026-10-10/scenarios/vocab_add.txt",
  "docs/cli/evidence/release-2026-10-10/scenarios/vocab_revamp.txt",
  "docs/cli/evidence/release-2026-10-10/scenarios/vocab_revamp_home_deck.txt",
  "docs/cli/evidence/release-2026-10-10/scenarios/vocab_split.txt"
 ],
 "failure_code": null
}
