{
 "schema_version": 1,
 "gate_id": "EV-09",
 "status": "pass",
 "version_matrix": {
  "linguist-anki-bridge": "0.1.0",
  "git_commit": "4e85a916b37b75ce9ff97a89e2675e5732f39f0c",
  "rustc": "rustc 1.99.0 (b940084d7 2026-09-28) (Arch Linux rust 1:1.99.0-1)",
  "cargo": "cargo 1.99.0 (5f94df478 2026-08-27) (Arch Linux rust 1:1.99.0-1)",
  "rust_msrv_declared": "1.98.1",
  "python": "Python 3.14.8",
  "anki_python": "Python 3.14.7",
  "anki": "25.09.2 3d813c83",
  "node": "v26.11.1",
  "tesseract": "tesseract 5.5.3",
  "tesseract_languages": "eng,jpn,osd,vie",
  "ollama": "0.40.1",
  "kernel": "Linux 7.2.8-5-omarchy-bore",
  "crate:ammonia": "4.2.0",
  "crate:clap": "4.6.7",
  "crate:image": "0.25.10",
  "crate:libsqlite3-sys": "0.38.2",
  "crate:reqwest": "0.13.5",
  "crate:rusqlite": "0.40.2",
  "crate:rustls": "0.23.45",
  "crate:schemars": "1.2.2",
  "crate:serde": "1.0.229",
  "crate:serde_jcs": "0.2.0",
  "crate:serde_json": "1.0.151",
  "crate:symphonia": "0.6.1",
  "crate:toml": "0.9.12+spec-1.1.0",
  "crate:uuid": "1.26.1",
  "crate:yaml-rust2": "0.13.0",
  "crate:zip": "8.6.0",
  "crate:zstd": "0.14.0"
 },
 "fixture_hashes": {
  "crates/linguist-application/tests/split.rs": "6fe4e0005e92df40e6aff74a6482173f8c1ac654f7f9d3e50024612339d94b31"
 },
 "commands": [
  {
   "redacted_argv": [
    "cargo",
    "test",
    "--locked",
    "-p",
    "linguist-cli",
    "--test",
    "desktop_scenarios",
    "--",
    "--ignored",
    "--test-threads",
    "1",
    "--nocapture"
   ],
   "invocation_digest": "20e337ed703325bbbeaa96024788d83947d339a8c7c750ec1d6b4d1c5b2de29c",
   "exit_code": 0,
   "output_digest": "e55bfda635d07e98aaafec76baeee1d1143f64d48e065aef81cc5d0814d8f429"
  },
  {
   "redacted_argv": [
    "cargo",
    "test",
    "--locked",
    "-p",
    "linguist-application",
    "--test",
    "jobs_apply",
    "--test",
    "apply",
    "--test",
    "restore",
    "--test",
    "split",
    "--test",
    "checkpoint_writes"
   ],
   "invocation_digest": "2b39bf564e329fc7cb59fd34bad27493e6d06fc8b34caee8951e1f0332ac05e9",
   "exit_code": 0,
   "output_digest": "2d3782be9a33fb534c770f4dfdbfc284d6359c046daaa224bb6fee1573f5657c"
  }
 ],
 "assertions": [
  {
   "name": "real-Anki split: sibling first, anchor keeps history, group rollback",
   "passed": true,
   "observed": "grammar_split scenario"
  },
  {
   "name": "partial-group crash: unit reconciled, group resumed, sibling not re-created",
   "passed": true,
   "observed": "grammar_split_crash scenario"
  },
  {
   "name": "real-Anki vocabulary split: anchor keeps history, new sibling note, group rollback deletes it",
   "passed": true,
   "observed": "vocab_split scenario (WP-20)"
  },
  {
   "name": "partial-group recovery rules",
   "passed": true,
   "observed": "fake native port"
  }
 ],
 "artifact_refs": [
  "docs/cli/evidence/release-2026-10-09/logs/jobs_executor.txt",
  "docs/cli/evidence/release-2026-10-09/logs/scenarios.txt",
  "docs/cli/evidence/release-2026-10-09/scenarios/batch_vocab_revamp.txt",
  "docs/cli/evidence/release-2026-10-09/scenarios/grammar_add.txt",
  "docs/cli/evidence/release-2026-10-09/scenarios/grammar_split.txt",
  "docs/cli/evidence/release-2026-10-09/scenarios/grammar_split_crash.txt",
  "docs/cli/evidence/release-2026-10-09/scenarios/identity_preconditions.txt",
  "docs/cli/evidence/release-2026-10-09/scenarios/native_faults.txt",
  "docs/cli/evidence/release-2026-10-09/scenarios/vocab_add.txt",
  "docs/cli/evidence/release-2026-10-09/scenarios/vocab_revamp.txt",
  "docs/cli/evidence/release-2026-10-09/scenarios/vocab_revamp_home_deck.txt",
  "docs/cli/evidence/release-2026-10-09/scenarios/vocab_split.txt"
 ],
 "failure_code": null
}
