{
 "schema_version": 1,
 "gate_id": "EV-13",
 "status": "pass",
 "version_matrix": {
  "linguist-anki-bridge": "0.1.0",
  "git_commit": "e3120c4f9360d7fb442fbf90abc530e969308bac",
  "rustc": "rustc 1.99.0 (b940084d7 2026-09-28) (Arch Linux rust 1:1.99.0-1)",
  "cargo": "cargo 1.99.0 (5f94df478 2026-08-27) (Arch Linux rust 1:1.99.0-1)",
  "rust_msrv_declared": "1.98.1",
  "python": "Python 3.14.8",
  "anki_python": "Python 3.14.7",
  "anki": "25.09.2 3d813c83",
  "node": "v26.10.0",
  "tesseract": "tesseract 5.5.3",
  "tesseract_languages": "eng,osd",
  "ollama": "0.35.1",
  "kernel": "Linux 7.2.5-4-omarchy",
  "crate:ammonia": "4.2.0",
  "crate:clap": "4.6.7",
  "crate:image": "0.25.10",
  "crate:libsqlite3-sys": "0.38.2",
  "crate:reqwest": "0.13.5",
  "crate:rusqlite": "0.40.2",
  "crate:rustls": "0.23.45",
  "crate:schemars": "1.2.2",
  "crate:serde": "1.0.229",
  "crate:serde_jcs": "0.2.0",
  "crate:serde_json": "1.0.151",
  "crate:symphonia": "0.6.1",
  "crate:toml": "0.9.12+spec-1.1.0",
  "crate:uuid": "1.26.1",
  "crate:yaml-rust2": "0.13.0",
  "crate:zip": "8.6.0",
  "crate:zstd": "0.14.0"
 },
 "fixture_hashes": {
  "crates/linguist-application/tests/maintenance.rs": "e028e4179de1487d2408ff566bdb7b0ebb1122a19415fdef8e39de61d98ccadd"
 },
 "commands": [
  {
   "redacted_argv": [
    "cargo",
    "test",
    "--locked",
    "-p",
    "linguist-application",
    "--test",
    "maintenance",
    "--test",
    "ollama"
   ],
   "invocation_digest": "09fa36ad3e15f43adbdcc2a42919b7a03a38f87d56f0d3ebd7c181c876aedaae",
   "exit_code": 0,
   "output_digest": "dc03d78767a16151f310cd3542a379a1ffd8092dfd86a4b5fcba9f12433f8479"
  },
  {
   "redacted_argv": [
    "cargo",
    "test",
    "--locked",
    "-p",
    "linguist-cli",
    "--test",
    "maintenance_commands"
   ],
   "invocation_digest": "1d8d7ab349283834a9a4c4ca1c88c45c420c705cb45fe94ed895799ab4cb40da",
   "exit_code": 0,
   "output_digest": "b758e6e96c0ad5591fcd747486a961b3780564051d81c031c047c5aa74041217"
  },
  {
   "redacted_argv": [
    "cargo",
    "test",
    "--locked",
    "-p",
    "linguist-provider"
   ],
   "invocation_digest": "86b6e0e0c48f8c9fe869d56a2747a77504402530abf56109d0eede5fa6bdb508",
   "exit_code": 0,
   "output_digest": "fbc8daa5017430e48e2300f08b6d81198447fdfd213fb8fde76495ea652986ff"
  }
 ],
 "assertions": [
  {
   "name": "hash/license/path/limit/offline/private-network resource tests",
   "passed": true,
   "observed": "local and loopback only"
  }
 ],
 "artifact_refs": [
  "docs/cli/evidence/release-2026-10-06/logs/provider_reader.txt",
  "docs/cli/evidence/release-2026-10-06/logs/resources.txt",
  "docs/cli/evidence/release-2026-10-06/logs/resources_cli.txt"
 ],
 "failure_code": null
}
