{
 "schema_version": 1,
 "gate_id": "EV-12",
 "status": "pass",
 "version_matrix": {
  "linguist-anki-bridge": "0.1.0",
  "git_commit": "b88e8f8e3ad927b77a443b20c8d7f38e997ea84a",
  "rustc": "rustc 1.99.0 (b940084d7 2026-09-28) (Arch Linux rust 1:1.99.0-1)",
  "cargo": "cargo 1.99.0 (5f94df478 2026-08-27) (Arch Linux rust 1:1.99.0-1)",
  "rust_msrv_declared": "1.98.1",
  "python": "Python 3.14.8",
  "anki_python": "Python 3.14.7",
  "anki": "25.09.2 3d813c83",
  "node": "v26.11.1",
  "tesseract": "tesseract 5.5.3",
  "tesseract_languages": "eng,jpn,osd,vie",
  "ollama": "0.40.1",
  "kernel": "Linux 7.2.8-5-omarchy-bore",
  "crate:ammonia": "4.2.0",
  "crate:clap": "4.6.7",
  "crate:image": "0.25.10",
  "crate:libsqlite3-sys": "0.38.2",
  "crate:reqwest": "0.13.5",
  "crate:rusqlite": "0.40.2",
  "crate:rustls": "0.23.45",
  "crate:schemars": "1.2.2",
  "crate:serde": "1.0.229",
  "crate:serde_jcs": "0.2.0",
  "crate:serde_json": "1.0.151",
  "crate:symphonia": "0.6.1",
  "crate:toml": "0.9.12+spec-1.1.0",
  "crate:uuid": "1.26.1",
  "crate:yaml-rust2": "0.13.0",
  "crate:zip": "8.6.0",
  "crate:zstd": "0.14.0"
 },
 "fixture_hashes": {
  "crates/linguist-application/tests/jobs_apply.rs": "d88008a984840d74f2fdd28b8908a5e9ac178ca36552191b7c35403111e8e9b3"
 },
 "commands": [
  {
   "redacted_argv": [
    "cargo",
    "test",
    "--locked",
    "-p",
    "linguist-store",
    "--test",
    "lease",
    "--test",
    "apply_job",
    "--test",
    "journal"
   ],
   "invocation_digest": "b5b242c05144c8e969115972c185e82a7328deebacf86c9684d5fa0ed7a9cf1d",
   "exit_code": 0,
   "output_digest": "b3b3b2c5193f8675dc8ede12b57b989214bc06cc50e733c4ca17b2e6717b16c3"
  },
  {
   "redacted_argv": [
    "cargo",
    "test",
    "--locked",
    "-p",
    "linguist-application",
    "--test",
    "jobs_apply",
    "--test",
    "apply",
    "--test",
    "restore",
    "--test",
    "split",
    "--test",
    "checkpoint_writes"
   ],
   "invocation_digest": "2b39bf564e329fc7cb59fd34bad27493e6d06fc8b34caee8951e1f0332ac05e9",
   "exit_code": 0,
   "output_digest": "83c0d140bcf8e24e23e7dd6ae172eca97a7be65728c7dff35a12a7e158c43575"
  },
  {
   "redacted_argv": [
    "cargo",
    "test",
    "--locked",
    "-p",
    "linguist-cli",
    "--test",
    "jobs_commands",
    "--test",
    "apply_commands",
    "--test",
    "restore_commands"
   ],
   "invocation_digest": "6cbc917237746037c86b27509ea0b596f2da8fce1857242bed03e18ea2a1aff0",
   "exit_code": 0,
   "output_digest": "d267e52db8d2654f3244e172adf15d2030f7b4618e2b2a23ac490eb748497247"
  }
 ],
 "assertions": [
  {
   "name": "lease, liveness, control, retry, mode and restart tests",
   "passed": true,
   "observed": "local store; fake native port"
  }
 ],
 "artifact_refs": [
  "docs/cli/evidence/release-2026-10-09/logs/jobs_and_leases.txt",
  "docs/cli/evidence/release-2026-10-09/logs/jobs_cli.txt",
  "docs/cli/evidence/release-2026-10-09/logs/jobs_executor.txt"
 ],
 "failure_code": null
}
