{
 "schema_version": 1,
 "gate_id": "EV-07",
 "status": "pass",
 "version_matrix": {
  "linguist-anki-bridge": "0.3.0",
  "git_commit": "49d34f9324355232fea5d2af7c821bb8598fcbdf",
  "rustc": "rustc 1.99.0 (b940084d7 2026-09-28) (Arch Linux rust 1:1.99.0-1)",
  "cargo": "cargo 1.99.0 (5f94df478 2026-08-27) (Arch Linux rust 1:1.99.0-1)",
  "rust_msrv_declared": "1.98.1",
  "python": "Python 3.15.0",
  "anki_python": "Python 3.14.8",
  "anki": "25.09.2 3d813c83",
  "node": "v26.11.1",
  "tesseract": "tesseract 5.5.3",
  "tesseract_languages": "eng,jpn,osd,vie",
  "ollama": "0.40.2",
  "kernel": "Linux 7.2.8-5-omarchy-bore",
  "crate:ammonia": "4.2.0",
  "crate:clap": "4.6.7",
  "crate:image": "0.25.10",
  "crate:libsqlite3-sys": "0.38.2",
  "crate:reqwest": "0.13.5",
  "crate:rusqlite": "0.40.2",
  "crate:rustls": "0.23.45",
  "crate:schemars": "1.2.2",
  "crate:serde": "1.0.229",
  "crate:serde_jcs": "0.2.0",
  "crate:serde_json": "1.0.151",
  "crate:symphonia": "0.6.1",
  "crate:toml": "0.9.12+spec-1.1.0",
  "crate:uuid": "1.26.1",
  "crate:yaml-rust2": "0.13.0",
  "crate:zip": "8.6.0",
  "crate:zstd": "0.14.0"
 },
 "fixture_hashes": {
  "crates/linguist-store/tests/journal.rs": "f9f11e31439728e44ad8f419ca1758dff394adeccc92def33f6c097672d1b16b",
  "addons/linguist_bridge/native.py": "2f7c59f116e2e9aae8f179c80f60ac7d79ffa7d9a0e34bbdc930485398051079"
 },
 "commands": [
  {
   "redacted_argv": [
    "cargo",
    "test",
    "--locked",
    "-p",
    "linguist-store",
    "--test",
    "lease",
    "--test",
    "apply_job",
    "--test",
    "journal"
   ],
   "invocation_digest": "b5b242c05144c8e969115972c185e82a7328deebacf86c9684d5fa0ed7a9cf1d",
   "exit_code": 0,
   "output_digest": "3591f8b6a47b9475eacb98b41fd0e9c3935116e309e2a5436bc680becb9e6704"
  },
  {
   "redacted_argv": [
    "cargo",
    "test",
    "--locked",
    "-p",
    "linguist-application",
    "--test",
    "jobs_apply",
    "--test",
    "apply",
    "--test",
    "restore",
    "--test",
    "split",
    "--test",
    "checkpoint_writes"
   ],
   "invocation_digest": "2b39bf564e329fc7cb59fd34bad27493e6d06fc8b34caee8951e1f0332ac05e9",
   "exit_code": 0,
   "output_digest": "77fa9ae32bb618c151f03c8bab46378bd4920730a153410c90e7f0eb5d7cefa7"
  },
  {
   "redacted_argv": [
    "cargo",
    "test",
    "--locked",
    "-p",
    "linguist-cli",
    "--test",
    "desktop_scenarios",
    "--",
    "--ignored",
    "--test-threads",
    "1",
    "--nocapture"
   ],
   "invocation_digest": "20e337ed703325bbbeaa96024788d83947d339a8c7c750ec1d6b4d1c5b2de29c",
   "exit_code": 0,
   "output_digest": "401eee0f678873465c5ac13f9b5398198212f4c898cbd5df884e283cb9484cf1"
  }
 ],
 "assertions": [
  {
   "name": "journal/dedupe/unknown-outcome rules",
   "passed": true,
   "observed": "fake native port"
  },
  {
   "name": "delayed worker past the deadline: reconcile adopts",
   "passed": true,
   "observed": "native_faults"
  },
  {
   "name": "crash between effect and receipt: one note, adopted",
   "passed": true,
   "observed": "native_faults (process exit)"
  },
  {
   "name": "duplicate UUID returns the stored state; changed payload refused",
   "passed": true,
   "observed": "native_faults"
  },
  {
   "name": "ENOSPC at the ledger boundary: failed before write, retry commits",
   "passed": true,
   "observed": "native_faults (injected ENOSPC, not a full filesystem)"
  },
  {
   "name": "removed marker: absence unproven, stays in recovery",
   "passed": true,
   "observed": "native_faults"
  },
  {
   "name": "apply job: crash mid-job reconciled, old-session checkpoint stops the job, follow-up job applies the rest, rollback per job",
   "passed": true,
   "observed": "batch_vocab_revamp scenario (WP-21)"
  },
  {
   "name": "campaign: pilot pause, Anki crash inside an apply job, restart, reconcile, follow-up job, verification, duplicate merge and restore",
   "passed": true,
   "observed": "campaign_restart_recovery scenario (WP-24)"
  }
 ],
 "artifact_refs": [
  "docs/cli/evidence/release-2026-10-12/logs/jobs_and_leases.txt",
  "docs/cli/evidence/release-2026-10-12/logs/jobs_executor.txt",
  "docs/cli/evidence/release-2026-10-12/logs/scenarios.txt",
  "docs/cli/evidence/release-2026-10-12/scenarios/batch_vocab_revamp.txt",
  "docs/cli/evidence/release-2026-10-12/scenarios/campaign_restart_recovery.txt",
  "docs/cli/evidence/release-2026-10-12/scenarios/grammar_add.txt",
  "docs/cli/evidence/release-2026-10-12/scenarios/grammar_split.txt",
  "docs/cli/evidence/release-2026-10-12/scenarios/grammar_split_crash.txt",
  "docs/cli/evidence/release-2026-10-12/scenarios/identity_preconditions.txt",
  "docs/cli/evidence/release-2026-10-12/scenarios/native_faults.txt",
  "docs/cli/evidence/release-2026-10-12/scenarios/vocab_add.txt",
  "docs/cli/evidence/release-2026-10-12/scenarios/vocab_revamp.txt",
  "docs/cli/evidence/release-2026-10-12/scenarios/vocab_revamp_home_deck.txt",
  "docs/cli/evidence/release-2026-10-12/scenarios/vocab_split.txt"
 ],
 "failure_code": null
}
